{
  "catalog_content_checksum_sha256": "5534832310de4d04252c3962c3ad5c2c662118f064038d469b9bdd39975f4d73",
  "change_clocks": [
    "discovery_time",
    "latest_classification_at",
    "latest_spectrum_at",
    "latest_messenger_at",
    "latest_retraction_at"
  ],
  "feed_count": 214,
  "feeds": [
    {
      "atom": {
        "bytes": 95647,
        "path": "ctas/data/feeds/all-events.xml",
        "sha256": "3454005d3e89a0f75f973e9dc3e9a9882db6cc964a21452e448d402b2fa649aa"
      },
      "description": "Every public CTAS record, newest change first.",
      "item_count": 100,
      "json_feed": {
        "bytes": 144243,
        "path": "ctas/data/feeds/all-events.json",
        "sha256": "674d02bc72973f9f7e50d639ec5ffbc4dd1f3847c423a6b7bddf9832c78bee9f"
      },
      "kind": "all",
      "member_count": 18137,
      "name": "all-events",
      "title": "CTAS \u2014 all public records"
    },
    {
      "atom": {
        "bytes": 96119,
        "path": "ctas/data/feeds/event-type/optical-transient.xml",
        "sha256": "d072ce688de52650f4c8f3d747a32be5b9f3d50d3be4a1c8679f45062bb4e039"
      },
      "description": "Public CTAS records whose event type is optical-transient, newest change first.",
      "item_count": 100,
      "json_feed": {
        "bytes": 145013,
        "path": "ctas/data/feeds/event-type/optical-transient.json",
        "sha256": "4704ecc56ad9581c3d3e0bf6eabe11f37be6c744c65d800c8a0e94c4d9b2e975"
      },
      "kind": "event-type",
      "member_count": 17134,
      "name": "optical-transient",
      "title": "CTAS \u2014 optical transient records"
    },
    {
      "atom": {
        "bytes": 83705,
        "path": "ctas/data/feeds/event-type/x-ray-transient.xml",
        "sha256": "c9ceb36b2e1c73484f91ff1fa3faaf2be6d7b51d49c4b9c902c05f21ab0cfeb3"
      },
      "description": "Public CTAS records whose event type is x-ray-transient, newest change first.",
      "item_count": 100,
      "json_feed": {
        "bytes": 130923,
        "path": "ctas/data/feeds/event-type/x-ray-transient.json",
        "sha256": "e281ac25b19f013c8d260fcb479acb9fc1d52cde13859f0119035f19cc4bda8a"
      },
      "kind": "event-type",
      "member_count": 102,
      "name": "x-ray-transient",
      "title": "CTAS \u2014 x ray transient records"
    },
    {
      "atom": {
        "bytes": 74046,
        "path": "ctas/data/feeds/event-type/gamma-ray-transient.xml",
        "sha256": "36179762405a041250b0993eaa43af9d767f779125a3731121db918360fc46c2"
      },
      "description": "Public CTAS records whose event type is gamma-ray-transient, newest change first.",
      "item_count": 100,
      "json_feed": {
        "bytes": 115785,
        "path": "ctas/data/feeds/event-type/gamma-ray-transient.json",
        "sha256": "f744328b052f825cc079592fd7f434c1de643610a5375ec1c6014664c09a9aba"
      },
      "kind": "event-type",
      "member_count": 168,
      "name": "gamma-ray-transient",
      "title": "CTAS \u2014 gamma ray transient records"
    },
    {
      "atom": {
        "bytes": 81168,
        "path": "ctas/data/feeds/event-type/gamma-ray-burst-candidate.xml",
        "sha256": "e511522892a6a4f917860a47bdad9cb16a0f8fbb0a9778cd1cc1f3f80493d123"
      },
      "description": "Public CTAS records whose event type is gamma-ray-burst-candidate, newest change first.",
      "item_count": 80,
      "json_feed": {
        "bytes": 118768,
        "path": "ctas/data/feeds/event-type/gamma-ray-burst-candidate.json",
        "sha256": "329a72de915a1a60b596970e270fe8636e18c408298832d66a49c5c324980835"
      },
      "kind": "event-type",
      "member_count": 80,
      "name": "gamma-ray-burst-candidate",
      "title": "CTAS \u2014 gamma ray burst candidate records"
    },
    {
      "atom": {
        "bytes": 94233,
        "path": "ctas/data/feeds/event-type/high-energy-trigger.xml",
        "sha256": "8d7420e7c03f1d4161743dcaaec0299bbe2dd625112f886796c6f6083302b86f"
      },
      "description": "Public CTAS records whose event type is high-energy-trigger, newest change first.",
      "item_count": 100,
      "json_feed": {
        "bytes": 140514,
        "path": "ctas/data/feeds/event-type/high-energy-trigger.json",
        "sha256": "c90ee5b02112a2ba2b9b4b946c12206277931141e037881d1b15423c406ca3f0"
      },
      "kind": "event-type",
      "member_count": 134,
      "name": "high-energy-trigger",
      "title": "CTAS \u2014 high energy trigger records"
    },
    {
      "atom": {
        "bytes": 36947,
        "path": "ctas/data/feeds/event-type/high-energy-count-rate-trigger.xml",
        "sha256": "e5d463c745b88793fb1054df48c936a07722f625ef34c4ebdbc4c85ee151bd4d"
      },
      "description": "Public CTAS records whose event type is high-energy-count-rate-trigger, newest change first.",
      "item_count": 39,
      "json_feed": {
        "bytes": 56336,
        "path": "ctas/data/feeds/event-type/high-energy-count-rate-trigger.json",
        "sha256": "40a66c3d798aad9856c8fc2bc09344bdf21bc9dc5c59f6b1d35678b4c9fbfcab"
      },
      "kind": "event-type",
      "member_count": 39,
      "name": "high-energy-count-rate-trigger",
      "title": "CTAS \u2014 high energy count rate trigger records"
    },
    {
      "atom": {
        "bytes": 98501,
        "path": "ctas/data/feeds/event-type/fast-radio-burst.xml",
        "sha256": "0eb91dc9f771a7bfa4aab7f7c776f433521dc114d48ae6908de9d8100a209141"
      },
      "description": "Public CTAS records whose event type is fast-radio-burst, newest change first.",
      "item_count": 100,
      "json_feed": {
        "bytes": 147165,
        "path": "ctas/data/feeds/event-type/fast-radio-burst.json",
        "sha256": "a934c5f9fc94de873acb4d6f56dd28a22502ccab3ce15e625f8a19627f025ea2"
      },
      "kind": "event-type",
      "member_count": 185,
      "name": "fast-radio-burst",
      "title": "CTAS \u2014 fast radio burst records"
    },
    {
      "atom": {
        "bytes": 1514,
        "path": "ctas/data/feeds/event-type/high-energy-neutrino.xml",
        "sha256": "4ed312f3c4b0954a2e781c842b3f9b9eea1156f7c8132f239628bcc77cbfa71c"
      },
      "description": "Public CTAS records whose event type is high-energy-neutrino, newest change first.",
      "item_count": 1,
      "json_feed": {
        "bytes": 2060,
        "path": "ctas/data/feeds/event-type/high-energy-neutrino.json",
        "sha256": "e40bf6e2988bc903ba08215b25cf64c80f2a70ef5a1ab80d6e784828c2bfa413"
      },
      "kind": "event-type",
      "member_count": 1,
      "name": "high-energy-neutrino",
      "title": "CTAS \u2014 high energy neutrino records"
    },
    {
      "atom": {
        "bytes": 102926,
        "path": "ctas/data/feeds/event-type/high-energy-neutrino-track.xml",
        "sha256": "6305009008d0a650dd55b384493ea585377eab4a8b7dbb6a9de01752e3b1c93e"
      },
      "description": "Public CTAS records whose event type is high-energy-neutrino-track, newest change first.",
      "item_count": 100,
      "json_feed": {
        "bytes": 151893,
        "path": "ctas/data/feeds/event-type/high-energy-neutrino-track.json",
        "sha256": "7c8a9407386a310141c987aaed71cb4b8ff08341452d6ff551f644cfca154a55"
      },
      "kind": "event-type",
      "member_count": 180,
      "name": "high-energy-neutrino-track",
      "title": "CTAS \u2014 high energy neutrino track records"
    },
    {
      "atom": {
        "bytes": 42816,
        "path": "ctas/data/feeds/event-type/high-energy-neutrino-cascade.xml",
        "sha256": "43f21f8d95d96aed718fb94cc75bf68e3bc2a7b4fee5bad1aa989056f118ce2e"
      },
      "description": "Public CTAS records whose event type is high-energy-neutrino-cascade, newest change first.",
      "item_count": 45,
      "json_feed": {
        "bytes": 65752,
        "path": "ctas/data/feeds/event-type/high-energy-neutrino-cascade.json",
        "sha256": "b6413f6a30aa4bda1881f7868389867785e5a4b2848bf4d12824eae2dc62df6c"
      },
      "kind": "event-type",
      "member_count": 45,
      "name": "high-energy-neutrino-cascade",
      "title": "CTAS \u2014 high energy neutrino cascade records"
    },
    {
      "atom": {
        "bytes": 27232,
        "path": "ctas/data/feeds/event-type/neutrino-gamma-coincidence-candidate.xml",
        "sha256": "12fa73f60417ab01165d8c6cec8115f42294756ef8c14a9741f546578e489560"
      },
      "description": "Public CTAS records whose event type is neutrino-gamma-coincidence-candidate, newest change first.",
      "item_count": 28,
      "json_feed": {
        "bytes": 41528,
        "path": "ctas/data/feeds/event-type/neutrino-gamma-coincidence-candidate.json",
        "sha256": "7041c5c076fa211bb644f17e0dd4493d8b836a77436e546669c955d17dc726fa"
      },
      "kind": "event-type",
      "member_count": 28,
      "name": "neutrino-gamma-coincidence-candidate",
      "title": "CTAS \u2014 neutrino gamma coincidence candidate records"
    },
    {
      "atom": {
        "bytes": 38027,
        "path": "ctas/data/feeds/event-type/terrestrial-gamma-ray-flash.xml",
        "sha256": "c361e249f96425c83a2521bc6bd86cba8bf98644a16e382778d9174db1f0c9a8"
      },
      "description": "Public CTAS records whose event type is terrestrial-gamma-ray-flash, newest change first.",
      "item_count": 39,
      "json_feed": {
        "bytes": 55779,
        "path": "ctas/data/feeds/event-type/terrestrial-gamma-ray-flash.json",
        "sha256": "34df765de5ce1590c76a58d287ea239a36275bb351b8fc96d36c6457a4e4ba85"
      },
      "kind": "event-type",
      "member_count": 39,
      "name": "terrestrial-gamma-ray-flash",
      "title": "CTAS \u2014 terrestrial gamma ray flash records"
    },
    {
      "atom": {
        "bytes": 1665,
        "path": "ctas/data/feeds/event-type/solar-flare.xml",
        "sha256": "a6cec2daff1d117a3bb3626ae26871de1f64a9f25a41c7dcbc0e53a8516c71fa"
      },
      "description": "Public CTAS records whose event type is solar-flare, newest change first.",
      "item_count": 1,
      "json_feed": {